{
  "$schema": "https://json-schema.org/draft/2020-12/schema",
  "$id": "book.schema.json",
  "title": "교재 한 권(WEEK) 구성 — AI가 쓰는 내용만. HTML 금지, 텍스트 + $LaTeX$",
  "description": "문항은 id로만 참조한다(기출: 문항 id, 창작: C-… 문제은행 id). 본문·정답·해설은 build가 data/problems·solutions·문제은행에서 가져온다. 텍스트 안 줄바꿈은 \\n.",
  "type": "object",
  "additionalProperties": false,
  "required": [
    "week",
    "total_weeks",
    "year_label",
    "subject_label",
    "days"
  ],
  "properties": {
    "week": {
      "type": "integer",
      "minimum": 1,
      "maximum": 99
    },
    "total_weeks": {
      "type": "integer",
      "minimum": 1,
      "maximum": 99
    },
    "year_label": {
      "type": "string",
      "description": "표지·뒤표지 [[ 학년도 ]] 예: 2027학년도"
    },
    "subject_label": {
      "type": "string",
      "description": "표지 [[ 과목 ]] 예: 수학Ⅰ"
    },
    "scale": {
      "enum": ["normal", "large"],
      "description": "테마 구성 규모: normal(기본, 테마당 2~3 DAY·8~13문항) | large(테마당 4~6 DAY·30~48문항, 연습은 난도 순서 필수). config theme_plan.large"
    },
    "special": {
      "type": "boolean",
      "description": "특강 모드: 여러 과목을 한 권에 담고 테마당 1 DAY부터 허용(config theme_plan.special_days)"
    },
    "figures": {
      "type": "object",
      "description": "기출 문항 그림 명세 {db id: 그림 명세}. 그림이 있는 기출(문항 figure)을 쓰면 필수",
      "additionalProperties": {
        "$ref": "figure.schema.json"
      }
    },
    "days": {
      "type": "array",
      "minItems": 1,
      "items": {
        "$ref": "#/$defs/day"
      }
    },
    "appendix": {
      "type": "object",
      "additionalProperties": false,
      "required": [
        "types"
      ],
      "description": "부록: 계산 연습(창작 문항만). DAY와 별도 파트로 해설 뒤에 붙는다",
      "properties": {
        "title": {
          "type": "string",
          "maxLength": 24,
          "description": "부록 제목(기본: 계산 연습)"
        },
        "intro": {
          "type": "string",
          "description": "부록 안내 글 (첫 유형 쪽 위에 실림)"
        },
        "types": {
          "type": "array",
          "minItems": 1,
          "items": {
            "type": "object",
            "additionalProperties": false,
            "required": [
              "title",
              "trap",
              "refs"
            ],
            "properties": {
              "title": {
                "type": "string",
                "maxLength": 24
              },
              "trap": {
                "type": "string",
                "description": "자주 하는 계산 실수(분석 JSON의 패턴)"
              },
              "habit": {
                "type": "string",
                "description": "검산 습관·실수 방지 한 줄"
              },
              "refs": {
                "type": "array",
                "minItems": 1,
                "items": {
                  "type": "string",
                  "pattern": "^C-(M1|M2|PS)-\\d{2}-\\d{3}$"
                }
              }
            }
          }
        }
      }
    },
    "advice": {
      "type": "object",
      "additionalProperties": false,
      "required": [
        "assessment",
        "methods"
      ],
      "description": "학습 조언(표지 다음 첫 쪽): 실력 평가 + 이 책을 쓰는 방법. 한 쪽에 들어가야 한다",
      "properties": {
        "title": {
          "type": "string",
          "maxLength": 24
        },
        "assessment": {
          "type": "string",
          "description": "내 수학 실력에 대한 평가 (3~5문장)"
        },
        "patterns": {
          "type": "array",
          "maxItems": 5,
          "items": {
            "type": "object",
            "additionalProperties": false,
            "required": [
              "name",
              "fix"
            ],
            "properties": {
              "name": {
                "type": "string"
              },
              "text": {
                "type": "string"
              },
              "fix": {
                "type": "string"
              }
            }
          }
        },
        "methods": {
          "type": "array",
          "minItems": 1,
          "maxItems": 6,
          "items": {
            "type": "object",
            "additionalProperties": false,
            "required": [
              "title",
              "text"
            ],
            "properties": {
              "title": {
                "type": "string"
              },
              "text": {
                "type": "string"
              }
            }
          }
        }
      }
    },
    "practice_layout": {
      "enum": [
        "single",
        "multi"
      ],
      "description": "연습 문항 판면: multi(기본, 한 쪽에 3~4문항·고난도는 2문항) | single(한 쪽에 한 문항)"
    }
  },
  "$defs": {
    "text": {
      "type": "string",
      "minLength": 1
    },
    "ref": {
      "type": "string",
      "pattern": "^((M1|M2|PS)-\\d{6}|C-(M1|M2|PS)-\\d{2}-\\d{3}|T-[A-Z0-9]{1,8}-\\d{3})$",
      "description": "기출 db id | 창작 C-… | 교재 T-…"
    },
    "pastref": {
      "type": "string",
      "pattern": "^(M1|M2|PS)-\\d{6}$"
    },
    "day": {
      "type": "object",
      "additionalProperties": false,
      "required": [
        "day",
        "theme",
        "title",
        "concept",
        "strategy",
        "first_pitch",
        "sign_reading",
        "practice",
        "replay",
        "sign_book"
      ],
      "properties": {
        "day": {
          "type": "integer",
          "minimum": 1,
          "maximum": 999
        },
        "theme": {
          "type": "string",
          "pattern": "^(M1|M2|PS)-\\d{2}$"
        },
        "title": {
          "$ref": "#/$defs/text",
          "description": "챕터 제목 (헤더 한 줄, 20자 안팎)"
        },
        "concept": {
          "type": "object",
          "additionalProperties": false,
          "properties": {
            "core": {
              "$ref": "#/$defs/text",
              "description": "핵심 개념 2~4문장: 정의 → 왜 → 어디에"
            },
            "figures": {
              "type": "array",
              "maxItems": 2,
              "items": {
                "$ref": "figure.schema.json"
              }
            },
            "analogy": {
              "$ref": "#/$defs/text",
              "description": "일상 비유 2~3문장, 요소별 대응"
            },
            "analogy_limit": {
              "$ref": "#/$defs/text",
              "description": "비유가 맞지 않는 곳 한 줄"
            },
            "map": {
              "type": "array",
              "minItems": 1,
              "maxItems": 6,
              "items": {
                "type": "object",
                "additionalProperties": false,
                "required": [
                  "k",
                  "v"
                ],
                "properties": {
                  "k": {
                    "$ref": "#/$defs/text"
                  },
                  "v": {
                    "$ref": "#/$defs/text"
                  },
                  "f": {
                    "$ref": "#/$defs/text",
                    "description": "교과서형: '식으로 쓰면' 칸"
                  }
                }
              }
            },
            "sections": {
              "type": "array",
              "minItems": 1,
              "maxItems": 4,
              "items": {
                "type": "object",
                "additionalProperties": false,
                "required": [
                  "title",
                  "blocks"
                ],
                "properties": {
                  "title": {
                    "$ref": "#/$defs/text",
                    "description": "번호 소제목: 개념을 한 문장으로"
                  },
                  "blocks": {
                    "type": "array",
                    "minItems": 1,
                    "items": {
                      "type": "object",
                      "additionalProperties": false,
                      "minProperties": 1,
                      "properties": {
                        "p": {
                          "$ref": "#/$defs/text",
                          "description": "문단(줄글)"
                        },
                        "eq": {
                          "type": "string",
                          "description": "가운데 줄 수식 ($ 없이 LaTeX)"
                        },
                        "table": {
                          "type": "object",
                          "additionalProperties": false,
                          "required": [
                            "head",
                            "rows"
                          ],
                          "properties": {
                            "head": {
                              "type": "array",
                              "items": {
                                "$ref": "#/$defs/text"
                              }
                            },
                            "rows": {
                              "type": "array",
                              "items": {
                                "type": "array",
                                "items": {
                                  "$ref": "#/$defs/text"
                                }
                              }
                            },
                            "hl": {
                              "type": "array",
                              "items": {
                                "type": "integer"
                              },
                              "description": "강조할 행 번호(0부터)"
                            }
                          }
                        },
                        "figure": {
                          "$ref": "figure.schema.json"
                        },
                        "beside": {
                          "type": "array",
                          "description": "figure 왼쪽에 둘 블록(p·eq)",
                          "items": {
                            "type": "object"
                          }
                        },
                        "figures": {
                          "type": "array",
                          "minItems": 2,
                          "maxItems": 2,
                          "items": {
                            "$ref": "figure.schema.json"
                          },
                          "description": "그림 두 개를 나란히"
                        }
                      }
                    }
                  }
                }
              }
            },
            "card": {
              "type": "object",
              "additionalProperties": false,
              "required": [
                "body"
              ],
              "properties": {
                "title": {
                  "$ref": "#/$defs/text"
                },
                "body": {
                  "$ref": "#/$defs/text"
                }
              }
            },
            "banner": {
              "$ref": "#/$defs/text",
              "description": "한 줄 요약 띠"
            },
            "example": {
              "type": "object",
              "additionalProperties": false,
              "required": [
                "q",
                "textbook",
                "skill"
              ],
              "properties": {
                "q": {
                  "$ref": "#/$defs/text"
                },
                "textbook": {
                  "$ref": "#/$defs/text"
                },
                "skill": {
                  "$ref": "#/$defs/text"
                },
                "note": {
                  "$ref": "#/$defs/text"
                }
              },
              "description": "확인 예제: 교과서적 해법과 실전 해법 비교"
            }
          },
          "anyOf": [
            {
              "required": [
                "core",
                "analogy",
                "analogy_limit",
                "map"
              ]
            },
            {
              "required": [
                "sections",
                "map"
              ]
            }
          ],
          "description": "기존형(core·analogy·map) 또는 교과서형(sections·card·banner·example·map). 교과서형은 STS_ext.html로 조판"
        },
        "strategy": {
          "type": "object",
          "additionalProperties": false,
          "properties": {
            "structure": {
              "type": "string",
              "description": "출제 구조. 비우면 themes.json kice_intent + signals"
            },
            "figure": {
              "$ref": "figure.schema.json"
            },
            "concept_ids": {
              "type": "array",
              "items": {
                "type": "string"
              },
              "description": "실전 개념 행으로 넣을 concepts.json 개념 id({기존테마}-C{n}). 이름·내용·쓰는 때를 build가 채운다"
            },
            "tools": {
              "type": "array",
              "description": "직접 쓰는 실전 개념 행(concept_ids 뒤에 붙는다)",
              "items": {
                "type": "object",
                "additionalProperties": false,
                "required": [
                  "name",
                  "body"
                ],
                "properties": {
                  "name": {
                    "$ref": "#/$defs/text"
                  },
                  "body": {
                    "$ref": "#/$defs/text"
                  },
                  "eq": {
                    "type": "string",
                    "description": "교과서형: 가운데 줄 수식 ($ 없이)"
                  },
                  "when": {
                    "$ref": "#/$defs/text",
                    "description": "교과서형: 이런 문제에서"
                  }
                }
              }
            }
          }
        },
        "first_pitch": {
          "type": "object",
          "additionalProperties": false,
          "required": [
            "signal",
            "ref",
            "type"
          ],
          "properties": {
            "signal": {
              "$ref": "#/$defs/text",
              "description": "THE SIGN: 이 챕터에서 읽을 신호와 핵심 질문 1~2문장"
            },
            "ref": {
              "$ref": "#/$defs/ref"
            },
            "type": {
              "$ref": "#/$defs/text",
              "description": "헤더의 [[ 유형 ]]"
            },
            "reuse_note": {
              "type": "string"
            }
          }
        },
        "sign_reading": {
          "type": "object",
          "additionalProperties": false,
          "required": [
            "hint",
            "analysis",
            "points",
            "verdict",
            "scouting"
          ],
          "properties": {
            "hint": {
              "$ref": "#/$defs/text",
              "description": "첫 판단·막히는 곳의 실마리. 풀이 금지"
            },
            "analysis": {
              "$ref": "#/$defs/text"
            },
            "points": {
              "type": "array",
              "minItems": 2,
              "maxItems": 4,
              "items": {
                "anyOf": [
                  {
                    "$ref": "#/$defs/text"
                  },
                  {
                    "type": "object",
                    "additionalProperties": false,
                    "required": [
                      "text"
                    ],
                    "properties": {
                      "title": {
                        "$ref": "#/$defs/text"
                      },
                      "text": {
                        "$ref": "#/$defs/text"
                      }
                    }
                  }
                ]
              }
            },
            "verdict": {
              "$ref": "#/$defs/text",
              "description": "측정 능력과 자주 나오는 오답"
            },
            "scouting": {
              "type": "array",
              "minItems": 1,
              "maxItems": 2,
              "items": {
                "type": "object",
                "additionalProperties": false,
                "required": [
                  "ref",
                  "note"
                ],
                "properties": {
                  "ref": {
                    "$ref": "#/$defs/pastref"
                  },
                  "note": {
                    "$ref": "#/$defs/text"
                  }
                }
              }
            }
          }
        },
        "practice": {
          "type": "array",
          "minItems": 1,
          "items": {
            "type": "object",
            "additionalProperties": false,
            "required": [
              "ref",
              "difficulty"
            ],
            "properties": {
              "ref": {
                "$ref": "#/$defs/ref"
              },
              "difficulty": {
                "enum": [
                  "기본 적용",
                  "조건 변형",
                  "복합 사고",
                  "고난도"
                ]
              },
              "reuse_note": {
                "type": "string",
                "description": "다른 테마 기출을 가져올 때 이 테마에서 읽을 신호 한 줄"
              },
              "reason": {
                "type": "string",
                "description": "후보(problem_ids·related_ids) 밖의 기출을 쓸 때 이유"
              }
            }
          }
        },
        "replay": {
          "type": "array",
          "minItems": 1,
          "items": {
            "type": "object",
            "additionalProperties": false,
            "required": [
              "no",
              "wrong",
              "stuck",
              "fix"
            ],
            "properties": {
              "no": {
                "type": "integer",
                "minimum": 1,
                "description": "이 DAY의 문항 번호(예제 1, 연습 2~)"
              },
              "wrong": {
                "$ref": "#/$defs/text"
              },
              "stuck": {
                "$ref": "#/$defs/text"
              },
              "fix": {
                "$ref": "#/$defs/text"
              }
            }
          }
        },
        "sign_book": {
          "type": "object",
          "additionalProperties": false,
          "required": [
            "next"
          ],
          "properties": {
            "rows": {
              "type": "array",
              "description": "문항별 행 덮어쓰기. 없는 번호는 build가 first_judgment·개념 이름으로 채운다",
              "items": {
                "type": "object",
                "additionalProperties": false,
                "required": [
                  "no",
                  "signal",
                  "method"
                ],
                "properties": {
                  "no": {
                    "type": "integer",
                    "minimum": 1
                  },
                  "signal": {
                    "$ref": "#/$defs/text"
                  },
                  "method": {
                    "$ref": "#/$defs/text"
                  }
                }
              }
            },
            "next": {
              "$ref": "#/$defs/text",
              "description": "다음 챕터로: 이 판단이 다음 DAY에서 어떻게 확장되는가"
            }
          }
        },
        "notes": {
          "type": "object",
          "description": "해설지 덮어쓰기 {문항 ref: {...}}",
          "additionalProperties": {
            "type": "object",
            "additionalProperties": false,
            "properties": {
              "tip": {
                "type": "string",
                "description": "실전 개념 줄"
              },
              "error": {
                "type": "string",
                "description": "오답 첨삭 줄"
              },
              "shortcut": {
                "type": "string",
                "description": "새 숏컷 풀이(기존 풀이 1을 대체). verify 필수"
              },
              "verify": {
                "type": "string",
                "description": "skill()이 정답 값을 돌려주는 코드"
              }
            }
          }
        }
      }
    }
  }
}
