{
  "week": 1,
  "total_weeks": 1,
  "year_label": "2027학년도",
  "subject_label": "수학Ⅱ",
  "figures": {},
  "days": [
    {
      "day": 1,
      "theme": "M2-01",
      "title": "분모의 0은 분자가 갚는다",
      "concept": {
        "sections": [
          {
            "title": "$x\\to\\infty$에서는 최고차항, $x\\to0$에서는 최저차항이 결정한다",
            "blocks": [
              {
                "p": "다항함수의 극한은 $x$가 어디로 가느냐에 따라 보는 항이 다르다. $x\\to\\infty$이면 가장 빨리 커지는 **최고차항**이 나머지를 압도하므로 분자·분모의 최고차항만 비교하면 되고, $x\\to0$이면 반대로 가장 늦게 작아지는 **최저차항**이 남는다."
              },
              {
                "table": {
                  "head": [
                    "극한",
                    "보는 항",
                    "결론"
                  ],
                  "rows": [
                    [
                      "$\\lim_{x\\to\\infty}\\frac{f(x)}{x^n}=c\\ (c\\ne0)$",
                      "최고차항",
                      "$f$는 $n$차, 최고차항 $cx^n$"
                    ],
                    [
                      "$\\lim_{x\\to0}\\frac{f(x)}{x^n}=c\\ (c\\ne0)$",
                      "최저차항",
                      "$f$의 최저차항은 $cx^n$"
                    ],
                    [
                      "$\\lim_{x\\to\\infty}x^nf\\left(\\frac1x\\right)$",
                      "$t=\\frac1x\\to0+$",
                      "최저차항 판정으로 바뀜"
                    ]
                  ],
                  "hl": [
                    2
                  ]
                }
              },
              {
                "p": "$x^nf'\\left(\\frac1x\\right)$처럼 낯선 꼴도 $t=\\frac1x$로 바꾸면 $\\frac{f'(t)}{t^n}$ $(t\\to0+)$이 되어 __최저차항 판정__으로 바뀐다. 두 극한이 다항식의 양 끝을 하나씩 정해 주는 것이다."
              }
            ]
          },
          {
            "title": "분모가 $0$으로 가면 분자도 $0$이어야 한다",
            "blocks": [
              {
                "figures": [
                  {
                    "fns": [
                      {
                        "expr": "x+2",
                        "domain": [
                          -3,
                          3
                        ],
                        "label": "y=(x-1)(x+2)/(x-1)",
                        "label_at": -1.2
                      }
                    ],
                    "points": [
                      {
                        "x": 1,
                        "y": 3,
                        "style": "open"
                      }
                    ],
                    "x": [
                      -3.2,
                      3.4
                    ],
                    "y": [
                      -1.5,
                      5.5
                    ],
                    "size": [
                      300,
                      200
                    ],
                    "caption": "분자도 $0$ → 약분되어 극한 존재"
                  },
                  {
                    "fns": [
                      {
                        "expr": "1/(x-1)",
                        "domain": [
                          -2,
                          0.8
                        ]
                      },
                      {
                        "expr": "1/(x-1)",
                        "domain": [
                          1.2,
                          4
                        ],
                        "label": "y=1/(x-1)",
                        "label_at": 3.2
                      }
                    ],
                    "vlines": [
                      {
                        "x": 1,
                        "style": "dash"
                      }
                    ],
                    "x": [
                      -2.2,
                      4.2
                    ],
                    "y": [
                      -5,
                      5
                    ],
                    "size": [
                      300,
                      200
                    ],
                    "caption": "분모만 $0$ → 발산"
                  }
                ]
              },
              {
                "p": "$\\lim_{x\\to a}\\frac{g(x)}{h(x)}$에서 $h(a)=0$인데 극한이 존재하려면 분자도 $0$이어야 한다. 분모의 근을 분자가 **흡수**해야 하는 것이다. 이때 중복도까지 따져 '분자의 중복도 $\\ge$ 분모의 중복도'여야 한다."
              },
              {
                "eq": "\\lim_{x\\to a}\\frac{g(x)}{(x-a)^k}\\ \\text{가 존재}\\iff g(x)\\text{가 }(x-a)^k\\text{으로 나누어떨어짐}"
              },
              {
                "p": "분모의 근을 모두 나열하고 다항식의 차수를 __근을 담을 수 있는 예산__으로 쓰면 가능한 경우가 빠르게 줄어든다. $n$차 다항식은 근을 중복을 포함해 $n$개까지만 가질 수 있다."
              }
            ]
          }
        ],
        "card": {
          "title": "개념 정리",
          "body": "① $x\\to\\infty$에서는 최고차항끼리, $x\\to0$에서는 최저차항끼리 비교한다.\n② $x\\to a$에서 분모 $\\to0$이면, 극한이 존재하기 위해 분자 $\\to0$이어야 한다.\n③ 분모 $(x-a)^k$을 흡수하려면 분자는 $(x-a)^k$으로 나누어떨어져야 한다."
        },
        "banner": "분모의 근을 모두 적고, 분자가 그 근을 모두 가지는지 확인한다.",
        "example": {
          "q": "다항함수 $f(x)$가 $\\lim_{x\\to\\infty}\\frac{f(x)}{x^2}=1$, $\\lim_{x\\to1}\\frac{f(x)}{x-1}=3$을 만족시킬 때, $f(2)$의 값을 구하시오.",
          "textbook": "$f(x)=x^2+px+q$로 두면 $x\\to1$에서 분모 $\\to0$이므로 $f(1)=1+p+q=0$.\n$\\frac{f(x)}{x-1}=x+1+p$ (인수분해) → $2+p=3$, $p=1$, $q=-2$.\n$f(2)=4+2-2=4$.",
          "skill": "최고차항 $x^2$ → 이차식. 분모의 근 $1$을 흡수 → $f(x)=(x-1)(x+b)$.\n약분한 값 $1+b=3$ → $b=2$.\n$f(2)=1\\times4=4$.",
          "note": "실전 해법은 처음부터 **근을 인수로 세워** 미지수를 하나 줄인다. 차수가 높아질수록 이 차이가 커진다."
        },
        "map": [
          {
            "k": "$x\\to\\infty$ 극한",
            "v": "최고차항끼리 비교",
            "f": "차수·최고차 계수 결정"
          },
          {
            "k": "$x\\to0$ 극한, $\\frac1x$ 치환",
            "v": "최저차항끼리 비교",
            "f": "$t=\\frac1x$"
          },
          {
            "k": "분모 $\\to0$",
            "v": "분자도 $\\to0$, 중복도는 분자 $\\ge$ 분모",
            "f": "$(x-a)^k\\mid g(x)$"
          },
          {
            "k": "'모든 $a$에서 극한 존재'",
            "v": "분모의 근이 없거나 모두 흡수",
            "f": "경우 나누기"
          },
          {
            "k": "요구되는 근이 여러 개",
            "v": "차수가 근의 예산",
            "f": "$n$차 → 근 $n$개 이하"
          }
        ]
      },
      "strategy": {
        "structure": "극한 조건 몇 개로 다항함수를 결정하게 한다. 각 극한이 **다항식의 어느 부분(최고차·최저차·근)**을 정하는지 번역하는 것이 첫 판단이고, 차수를 근의 예산으로 써서 경우를 줄인다.",
        "tools": [
          {
            "name": "양 끝 차수",
            "body": "$x\\to\\infty$ 극한은 최고차항을, $x\\to0$ 극한은 최저차항을 정한다. $\\frac1x$ 치환으로 두 방향을 오간다.",
            "eq": "\\lim_{x\\to\\infty}x^nf'\\!\\left(\\tfrac1x\\right)=\\lim_{t\\to0+}\\frac{f'(t)}{t^n}",
            "when": "두 극한이 다항식의 서로 다른 끝을 정할 때"
          },
          {
            "name": "근 흡수",
            "body": "분모가 $0$이 되는 점마다 분자도 같은 근을 같은 중복도 이상으로 가져야 한다.",
            "eq": "\\lim_{x\\to a}\\frac{g(x)}{(x-a)^k}\\ \\text{존재}\\iff(x-a)^k\\mid g(x)",
            "when": "분수 꼴 극한의 존재 조건"
          },
          {
            "name": "근의 예산",
            "body": "$n$차 다항식은 근을 $n$개까지 가진다. 요구되는 근을 세어 가능한 경우를 걸러낸다.",
            "eq": "\\deg g=n\\ \\Rightarrow\\ \\text{근은 중복 포함 }n\\text{개 이하}",
            "when": "여러 점에서 극한이 존재해야 할 때"
          }
        ]
      },
      "first_pitch": {
        "signal": "두 극한이 모두 $x\\to\\infty$인데 하나는 $f(x)$, 하나는 $f'\\left(\\frac1x\\right)$를 담고 있다. 한쪽은 최고차항, 한쪽은 최저차항을 정해 준다는 신호다.",
        "ref": "T-V11-005",
        "type": "양 끝 차수로 다항식 결정"
      },
      "sign_reading": {
        "hint": "$x^nf'\\left(\\frac1x\\right)$에서 $t=\\frac1x$로 바꾸면 무엇이 $0$으로 가는지 보자.",
        "analysis": "두 극한이 모두 $x\\to\\infty$이지만 하는 일이 다르다. 첫 극한은 $f$의 **위쪽 두 항** $x^{n+3}+x^{n+2}$을 정하고, 둘째 극한은 $t=\\frac1x$로 바꾸면 $\\frac{f'(t)}{t^n}$ $(t\\to0+)$이 되어 $f'$의 **가장 낮은 항** $x^n$을 정한다. 그 사이가 비어 있으므로 $f$가 완전히 정해지고, (나)의 부호 조건이 $n$을 거른다.",
        "points": [
          {
            "title": "최고차",
            "text": "$f(x)-x^{n+3}$의 최고차항이 $x^{n+2}$이므로 $f(x)=x^{n+3}+x^{n+2}+(n+1\\text{차 이하})$이다."
          },
          {
            "title": "최저차",
            "text": "$f'$의 최저차항이 $x^n$이므로 $f(x)=x^{n+3}+x^{n+2}+\\frac1{n+1}x^{n+1}+c$이다."
          },
          {
            "title": "(나)로 거르기",
            "text": "$f(0)=0$이고, $xf(x)=x^{n+2}\\left(x^2+x+\\frac1{n+1}\\right)\\ge0$이려면 $n$이 짝수이고 판별식이 $0$ 이하여야 하므로 $n=2$이다."
          }
        ],
        "verdict": "극한 조건을 다항식의 계수 조건으로 번역하는 능력을 본다. (나)에서 판별식 조건을 빠뜨려 $n$이 여러 개 남는 오답이 많다.",
        "scouting": [
          {
            "ref": "M2-270611",
            "note": "같은 점: 분모 $\\to0$이면 분자 $\\to0$으로 함숫값을 정한다. 다른 점: '존재하지 않는다'는 조건도 식 하나를 준다."
          },
          {
            "ref": "M2-260913",
            "note": "같은 점: '모든 $a$에서 존재'를 분모의 근 흡수로 번역한다. 다른 점: 분모의 근이 없는 경우도 답에 들어간다."
          }
        ]
      },
      "practice": [
        {
          "ref": "M2-270611",
          "difficulty": "기본 적용"
        },
        {
          "ref": "M2-260913",
          "difficulty": "조건 변형"
        },
        {
          "ref": "T-V11-011",
          "difficulty": "복합 사고"
        },
        {
          "ref": "M2-240915",
          "difficulty": "복합 사고"
        },
        {
          "ref": "T-V11-006",
          "difficulty": "고난도"
        }
      ],
      "replay": [
        {
          "no": 1,
          "wrong": "(나)에서 $n$이 짝수이기만 하면 $x^{n+2}\\left(x^2+x+\\frac1{n+1}\\right)\\ge0$이라고 본다.",
          "stuck": "$n=4,6,\\dots$도 답이 되어 $f'(1)$이 정해지지 않는다.",
          "fix": "괄호가 음수가 되는 구간이 있는지 판별식으로 확인한다 — 두 근이 모두 음수라 그 사이에서 깨진다."
        },
        {
          "no": 2,
          "wrong": "$a=0$일 때 존재하므로 $f(0)=3$이라고 둔다.",
          "stuck": "분모 $x\\{f(x)-3\\}$에서 이미 $x$가 $0$을 만든다는 것을 놓친다.",
          "fix": "분모를 $0$으로 만드는 인수가 무엇인지 먼저 — 요구되는 것은 분자 쪽 $f(2)=0$이다."
        },
        {
          "no": 4,
          "wrong": "$g(n)$을 첫 극한만 보고 '$n$에서의 중복도'로 둔다.",
          "stuck": "$g(7)+g(8)=3$을 만족하는 경우가 너무 많아진다.",
          "fix": "두 극한의 제약 중 더 빡빡한 쪽 — $g(n)=\\min\\left(m_n,\\left\\lfloor\\frac nd\\right\\rfloor\\right)$."
        },
        {
          "no": 6,
          "wrong": "분모의 근을 $x^2-(k+1)x+4=0$에서만 찾는다.",
          "stuck": "$k=5$에서 음근 $-2$가 분자에 흡수되는 설계를 놓쳐 $k$의 개수가 맞지 않는다.",